reviewId,app_name,content,sentiment_polarity,sentiment
201212b7-9f50-4dbc-a841-2156b25e6b15,Photo&File Detect,lix aplic tod hor buzin víru desinstal sai celul,negative,anger
021ca79f-c814-43e3-8e92-15839cc66e3f,Photo&File Detect,véi app horr minut aparec anúnci n recom,negative,anger
11bd1421-a431-4ee4-a208-bceff317ef5b,Photo&File Detect,aplic abr propagand celul tamp tod,negative,disgust
d60b393f-38fa-4f29-96fc-db67dc2f1724,Photo&File Detect,aplic aparec outr imag fic difícil ach aplic vc tá removernd,negative,disgust
7c4fb9c8-1964-4e7f-8ec4-25d0fb11aef2,Photo&File Detect,acab abr vou ver bom cel trav apen estrel vali dar cinc bom,neutral,neutral
f8b44210-4d12-4650-8a6d-e314b9e53a4a,Photo&File Detect,cois chat mech celul apag fot aparec anúnci cad segund chat deu,negative,anger
8e6dffa0-8b9c-4fae-81ad-1942c6c5ef86,Photo&File Detect,app víru fic tof moment apresent anúnci permit faz nad telefon outr app,negative,anger
27bf153c-7221-4e6e-8659-b7538d493ac1,Photo&File Detect,péss gost dess aplic tod hor aparec celul pod abaix indic ninguém abaix,negative,anger
a37bb41d-e160-460d-915e-3f3ab0940697,Photo&File Detect,muit propagand temp tod,negative,disgust
d8a226df-3391-457a-b92e-c6b79170a5d9,Photo&File Detect,horr app dar faz nd simples anúnci,negative,anger
a8798f4e-520a-4ad2-9c62-45004af7678f,Photo&File Detect,insatisfeit app porqu nao limp nad mi fal raiv éu quer verdad verdad inter pod mand mens baix porqu suu posi aceit verdad desculp fal cois err bom dia,negative,anger
6694d7c8-20af-4443-8528-84e998ed4cc0,Photo&File Detect,ñ gost anúnci ñ abr nad,negative,disgust
319b4bf2-caa1-4cc0-b524-ab57cd287bac,Photo&File Detect,vi bom mim cancel vi vári coment bom vi ruim cancel,neutral,neutral
a4089bc5-2d88-474f-8c6c-cd378c1bcb83,Photo&File Detect,baix ver par aparec anúnci,negative,disgust
01a21255-4ab8-4a9e-a047-db8e800e4470,Photo&File Detect,horr serv entup celul anúnci,negative,anger
3bc2a6a0-bd0d-4b43-b107-9f677923557f,Photo&File Detect,muit mens ench sac pod apag,negative,anger
5ac3f507-3c47-4a06-8910-7971548ac3ae,Photo&File Detect,horr baix n consegu entr di bom verdad horr maí,negative,anger
b49b4a0f-96da-4a37-a396-7f5d177a3aed,Photo&File Detect,garot ta cert aplic lixooooo fic jog aparec recomendoooo quer play stor tir app daqu app ridicul fei,negative,anger
ad5ec5a4-6615-4f7d-8f1a-423eabef1ce5,Photo&File Detect,vm lá app horr atrapalh plmdsparad aparec app troux víru celul,negative,anger
e595eb5d-3d40-412c-bc5f-07fa30eb2a1f,Photo&File Detect,horr fic pass anúnci,negative,anger
a8a5ab36-9140-4b7b-9fa7-b20e2bf1ec4f,Photo&File Detect,gost dess aplic faz cois telefon tod hor tr,negative,disgust
88fcad73-558a-4488-bc2f-cdd1da39aa22,Photo&File Detect,chat anúnci,negative,disgust
03c7f273-674a-4cd1-9a99-5667d6381471,Photo&File Detect,aplic lix serv nad fic vind comerc instal dess dar zer estrel dav app lix serv porr nenhum,negative,anger
ac396386-c016-4c4d-bfc3-c4f3262360f3,Photo&File Detect,aparec vide atrapalh,negative,disgust
ead1732f-3fd7-4bc2-bc01-6b37e93d7d17,Photo&File Detect,consig tir anúnci,negative,disgust
236eeb3a-396b-4bbb-9ff5-70708fa8b79a,Photo&File Detect,mó chat inclusiv propagand fic parec tod hor chat,negative,disgust
ef8f37a9-cf29-420e-8fdb-c45b47dd5efa,Photo&File Detect,app aparec nn cell quer ver alg víde nn dar caus dess app,negative,disgust
c1026e57-cc94-4fba-ba01-645b28d3d897,Photo&File Detect,man vai engan troux velh coloc víru celul outr cad segund aparec anúnci celul,negative,anger
c79713b5-733c-415f-9737-7c178bb32de2,Photo&File Detect,consig faz limp celul aplic,negative,disgust
fce2890a-ff23-4732-b82c-21459d784b36,Photo&File Detect,chat tod hor fic aparec,negative,disgust
7110a4cd-5067-4198-99fb-e231139c6b15,Photo&File Detect,quer app fic entr celul atrapalh outr app quer,negative,anger
55f63cb7-e066-4c27-ad6a-6b8e13f97e1b,Photo&File Detect,gost coloq fot vai contat,negative,disgust
b3998335-eb5c-4454-bd63-aa2aa7fb35a7,Photo&File Detect,qu abr sei celul ruim ouu aplic,negative,disgust
8116087d-7d17-4b23-b3d6-8adc73af9a1c,Photo&File Detect,ruim colet dad,negative,disgust
bc805fd6-6f40-4464-b9cb-f2133c832ed8,Photo&File Detect,ruim nao clic ja aparec anuci,negative,disgust
ae7a8d12-329d-41f8-9c58-1c3c7da8c5aa,Photo&File Detect,gost dess aplic ruim caus gast bat,negative,disgust
7e0f3f1e-27b3-4e94-b87d-be8394dd8821,Photo&File Detect,aparec anúnci tod hor dess aplic,negative,disgust
674c842c-eeda-4041-a7f5-00eefc4c00c4,Photo&File Detect,péss aparec anunci,negative,anger
c0477337-073f-416c-af36-61a8acf636d4,Photo&File Detect,baix aplic faz limp recomend deu nad,neutral,neutral
88cea4c4-d743-464e-821d-2f30ced4f4bf,Photo&File Detect,péss fic tod hor entr anúnci,negative,anger
da2a5fe7-6299-4284-ba85-c41d9456d631,Photo&File Detect,nad diz horr baix propagand aparec,negative,anger
f77de6e2-c08a-4c35-8740-5892e3489f4a,Photo&File Detect,desgr ruim n prest nad dá raiv desgr dess vend desgr dess app nao uss desgr dess app,negative,anger
b64933ad-abb2-469e-8a55-ac59934aad12,Photo&File Detect,anúnci,neutral,neutral
95ccb429-94eb-4c64-b691-f9fe4a03dd0d,Photo&File Detect,man aplic aparec celul baix so par aparec quer baix tchau,negative,disgust
b6c5680b-0289-4fef-84ee-f06af7c22702,Photo&File Detect,esper resolv problem celul fic muit satisfeit aplic,neutral,neutral
eeeab88d-a0a5-441f-93b7-3b2d853d45ef,Photo&File Detect,aplic orrivel tod hor anúnci,negative,anger
e20be366-4977-4038-8782-dde59d03043f,Photo&File Detect,tô ódi est off aparec poh propagand baix par aparec,negative,anger
55a3011c-f611-41e6-9951-3ca1b0548a97,Photo&File Detect,horr péss odi use aind aplic quer instal outr applic limp aí aparec vei anúnci daí ach norm vier vári fic ind um minut agor tô escrev aparec bem um anúnci dou estrel estrel aind quê dar dou estrel quê possível post feedback estrel opn desculp edit app ruim,negative,anger
b61c3170-270f-433f-b0d9-65b0e2159ec7,Photo&File Detect,pi app mund consig estud consig faz nad aparec anúnci aparec app intuit ach don program sum pesso tent tir app q ir playstory apag app arrepend odi opin app aqu playstory,negative,anger
6573c4a6-4efd-46da-ad12-081677e6ebad,Photo&File Detect,sofr problem q con propagand ir configur app lá vc vai procur app nom branc desinstal q vc desinstal tel inic aind vai fic lá app invis sla faz q anúnci par,neutral,neutral
86b505da-94fa-45c8-a80c-63187a96d69c,Photo&File Detect,app víru pur menin mex celul instal celul minut aparec anúnci nad horr baix víru,negative,anger
9ec9c8bf-4dac-4e80-a706-bf78f1c3b599,Photo&File Detect,lix app cheg bgl cll víru tent baix lixoo melhor mud acontec nad real horr recom,negative,anger
ed876331-2f23-4a7e-b210-bcdfa480f7d3,Photo&File Detect,app horr além aparec mont contat aqq n abr fic aparec mont anúnci celul fic trav dic dez abaix jog aplic duvid app,negative,anger
afb826aa-9e1a-4c6f-a952-3a83ae6ae72b,Photo&File Detect,odi aplic lix tô muit anúnci aqu sei oqu faz cad minut aparec anúnci lixooo instal aplic dá abr precis tir anúnci chat precis ter jeit consert opin ent cri dess aplic lix acab aparec anúnci aqu opin,negative,anger
3e4c7796-af4c-483b-9e1d-50ae53388712,Photo&File Detect,horri app lix tod lend coment vá pont denunci app horri aparec anúnci cad minut nn prest sequ entr dia faz torr ouv músic vei anúnci escrit celul víru tav grav áudi bem import sobr trabalh escol mãe nad aparec anúnci horri péss nn recom recom denunci app,negative,anger
e6883483-f67c-40a8-ae2e-2f1c12aa5a14,Photo&File Detect,horr desinstal anunci continu aparec nad sei faz esper aplic ban,negative,anger
18670dcc-50bf-40d3-9d36-5dd97a570e68,Photo&File Detect,aplic recomend víru pod desinstal send aplic nom icon vá aplic configur orden últ uso prova aparec aplic nom ent desinstal,neutral,neutral
d9802c4b-85ef-4146-8bbc-91fa821a214a,Photo&File Detect,abr aplic vou desinstal,negative,disgust
22ff0761-dda8-42e4-9276-5dc6de87f024,Photo&File Detect,man quer abaix víru celul aparac tod hor abaix dei quer dar,negative,anger
cfcaf3ac-e599-4962-b60e-78209a941e35,Photo&File Detect,mn aplic ruim fic aparec propagand diss minut fal víru celul send instal gta san ande mn recom instal peg víru caus diss dess aplic play stor dev remov aplic mn,negative,anger
58c89632-9b44-445a-911e-249d87a21b66,Photo&File Detect,mn negóci fic aparec anúnci tod hor velh estral,negative,anger
803acee2-9b18-4b06-97c3-77926d40653b,Photo&File Detect,definitiv app prest fic aparec anúnci nad interf mex celul pesso,negative,anger
cce68580-0b1a-408b-98d3-e41c1710733a,Photo&File Detect,tutor livr anúnci configur aplic proc fot fund branc lis nom apen quant meg usa cham aplic fantasm exist aparelh vdd clic nel desinstal,neutral,neutral
6e263a1a-87d9-476e-a7de-75ff4a39c1a3,Photo&File Detect,gent tend problem app anúnci vão configur aparelh vão app ver algum app suspeit nom fot apert desinstal anúnci vão par aparec incomod ocorr confi mim,neutral,neutral
47940c75-8c85-45e8-8304-ba74a9553c4f,Photo&File Detect,ótim pod cont vc nest ajud obrig,positive,happiness
53621692-f576-4063-824e-673cd34b97bb,Photo&File Detect,descrev sobr aplic control celul tod aplic entr comerc cad segund est aplic pod instal aplic aparec tel inic encontr aplic configur recom escrev mont reclam porqu hack,negative,anger
0b0b5aa4-beac-40b4-9c0b-bcc423872e4d,Photo&File Detect,app orrivel vou prosseç empr nao anúnci,negative,anger
718eb8a5-1774-431a-923e-72df63115dd1,Photo&File Detect,epp ruim vid vê mand anúnci celul,negative,anger
0f633f25-8e74-438f-a881-ef3d33172573,Photo&File Detect,ach aplic viru aparec so celul nao aparec menu escond app aparec vide tod hor anunci tod hor nao consegu nech celul hor desinstal par,negative,disgust
a14a0b4e-fb17-4fbd-8994-db1bc39b82c4,Photo&File Detect,horr aplic denunci fic aparec propagand dess aplic celul nad aplic ajud nad tent abaix aplic ver propagand par aparec adiant nad aplic tá aparec nad ajud dá prejuíz ódi app,negative,anger
9b6b2160-89da-46b4-b4ee-46ba68cc815d,Photo&File Detect,limp favor obrig pq limp tod hor vem anunci atrapalh serviç ok,negative,disgust
14eed1a6-f34f-4d01-9c08-8b9e023f4f1b,Photo&File Detect,ode aplic apar anuci viru víru fic parec anuci du nad quer denuci aplic pf v quer ban pfv,negative,anger
8b34d185-a58b-444b-8a9d-dc5a1f746c70,Photo&File Detect,ajud ganh dinh celul funcion sistem,positive,happiness
d9e27d58-2139-4ad6-b390-129a1f84d0e0,Photo&File Detect,horr odi instal fic aparec propagand tod sant hor tô tik tok aparec propagand tô jog tod hor recom nenhum pouc,negative,anger
e80b86d9-a4ad-4f13-9a64-6b98115886c1,Photo&File Detect,péss ench sac tod hor,negative,anger
854c0d6e-51d1-46b8-b18c-13f455d288d8,Photo&File Detect,ruim n func diret,negative,anger
f5057a37-5730-4f75-bd90-3f89a66335f1,Photo&File Detect,obrig abaix aplic fic aparec temp tod acontec denunci jur consig jog jog aparec anunci coloc estrel porqu aplic permit,negative,disgust
6b5208de-c761-4146-af6b-c4adef6e9742,Photo&File Detect,ruim atrapalh uso celul doi doi segund aparec detect alg err caus transtorn app prest simpl assim,negative,anger
adf09449-e78d-4067-8f0c-ef4f5c80df77,Photo&File Detect,porqu googl faz igual appl deix aplic chei propagand plataform baix faz aparelh trav consom bat etc,neutral,neutral
b412933b-4100-4918-bdec-668a5ab81de6,Photo&File Detect,app lix cri outr cont googl pod par anúnci vc baix som td playstor baix aparec anúnci baix app pq vir n coloqu celul risc,negative,anger
a2848401-4eea-4919-b98d-d6ebf0b8203a,Photo&File Detect,horr simples dá mex sempr q entr nel aparec list contat enfim denunci poi péss recom,negative,anger
80c30153-293e-4603-8155-0f8c02fee4ff,Photo&File Detect,app ruim tod hor surg anunci nov além surg app nao baix app ach exager lei outr coment,negative,anger
4a757f3e-45b6-48cf-9cb3-8e29a4ef01a2,Photo&File Detect,aplic nociv chei viru,negative,disgust
af37c931-d950-4b4b-8c6a-0a4e079161d8,Photo&File Detect,agor encontr soluç problem resolv vou desinstal,neutral,neutral
971636a1-7f55-4e02-bd4a-9cbe754a5939,Photo&File Detect,fic mand mens pro celul fal víru pess,negative,anger
493c6eea-7dc2-4103-aab9-4cd62fb53156,Photo&File Detect,aplic atrapalh entr minut minut atrapalh us celul favor tir daqu urgent,negative,disgust
8c1b87b3-1158-4148-a9b6-73aba2dabdc0,Photo&File Detect,horri aplic inutil lix serv propósit dá propagand cad min deix celul quas inutiliz,negative,anger
a541fed0-2f50-4987-93b2-b5de77540914,Photo&File Detect,ruim apag nad,negative,anger
12e7fbdf-ac50-4d6e-a0c4-36a188eb9b4a,Photo&File Detect,aplic chat tod hor fic aparec propagand chat aplic baix celul tod hor fic aparec propagand quer man propagand chat desenvolv favor aparec propagand chat,negative,disgust
e5a5c57c-02dc-43bb-b6ab-636c362e9dec,Photo&File Detect,app lix mex cll aparec nd ñ gost vai instal ñ adiant nd md cll quas nd fic limp cad minut,negative,anger
a45a1222-059a-47b0-89be-d1b6034cf756,Photo&File Detect,ridicul so atrapalh celul,negative,anger
d4058376-0364-4dfa-ba39-6058e4fa6020,Photo&File Detect,lix dev googl stor,negative,anger
9a25255a-1a87-48b1-99fe-74c973c236cd,Photo&File Detect,odi entr nunc caral t t,negative,anger
d4e11c98-5b8d-4bc2-b875-7f6d64bb5ebe,Photo&File Detect,nn quer q apareç anúnci celul,neutral,neutral
ade7a1ef-ad05-4e97-8c8c-abb50173166b,Photo&File Detect,bonit fot,positive,happiness
92159744-ca7d-4dc9-95ea-e114502796cd,Photo&File Detect,bom tir víru,positive,happiness
5b13bb6d-8e9f-4fec-8117-b95d6f4a82fd,Photo&File Detect,aparec nom sei porqu tô assist tik tok aparec,neutral,neutral
411c2a83-545c-44ce-9c5a-ed847f0e1244,Photo&File Detect,cheg anunci tá fic cans denunci app hack lend c tá horr,negative,anger
c04a6233-8e4a-4276-810d-8db4a6caf99c,Photo&File Detect,app quer app tent instal aparelh temp tod consig fic minut app tent instal víru,negative,disgust
88f72127-0374-4e29-a681-62b1c37a39af,Photo&File Detect,aplic chat vei tod hor aparec agor tav escrev anúnci aparec aff aparec vez poss faz nad celul anúnci aparec tir log ar aff,negative,anger
e1c93e09-8918-4a23-bfd3-be6f506dc8b9,Photo&File Detect,aparec anúnci cad minut app fech app ruim,negative,anger
f26b86c0-59ec-4fce-8e22-36ec081225aa,Photo&File Detect,péss víru bug celul cad minut fic mesm propagand,negative,anger
dc4f8c53-085e-4aca-ad65-1dce429ff0c5,Photo&File Detect,lix aplic sobrepõ tod outr aparec anúnci cad segund tel baix,negative,anger
f14fbd7d-0513-4d5f-8054-0b80a96fea79,Photo&File Detect,desgr anúnci,negative,anger
2ff1b321-50e7-4057-845f-18e5dd81d578,Photo&File Detect,app lix lib arqu chrom celul doi doi minut pai trabalh táv consegu caus diss denunci poi n nad av nom,negative,anger
2efa500a-aa30-41a4-91bc-4b6e1d7356db,Photo&File Detect,app fic engan gent instal dá instal dá jog verdad engan faz víde celul fic fic faz cois maluc fic bug gent entr jogu aparec começ começ reinici,negative,disgust
0562a30c-e179-4bc0-9813-109557def2b2,Photo&File Detect,app aparec nad minut abaix nad propagand diret horr viu consig fal whatsapp aparec alarm nad,negative,anger
b886cf69-b905-44f5-a474-2ad5f8d9ed0d,Photo&File Detect,ruim aparec comerc tod hor vc jog aparec vc qu aplic aparec cormec atrapalh experi tom comerc,negative,anger
c9c0d3ef-6070-435e-8c39-8be84bfa85ad,Photo&File Detect,gost porqu ant instal incomod,negative,disgust
3842753a-aa3a-4b9e-ac19-fd20fd829481,Photo&File Detect,man ir aplic q n aparec áre trabalh vc desativ notific desinstal esper ter ajud baix desinstal,neutral,neutral
caf6e06d-1dbf-498d-9785-4387b0454ff6,Photo&File Detect,horr app serv trav celul deix lo chei anúnci mim ach problem demor favor instal,negative,anger
7ed1f4e9-9355-4efa-bb35-9ce086bf7b6b,Photo&File Detect,dei estrel pq dar nad app lixoooo entr app mesm hor aparec alert viru app limp viru dusposi deu viru not recom nad nad,negative,anger
34b8b07d-d697-433e-b33b-b3a38f06f1fc,Photo&File Detect,horri chei anunci abaix nao consegu entr log celul nao par ter anunci nao abaix,negative,anger
d0a9f932-1555-4364-bc07-a87e92fc076d,Photo&File Detect,deu aguent tip minut aparec comerc dess aplic vend algum jog youtub aparec aguent dou not zer aplic,negative,anger
86797e50-c727-4a17-90fd-25f1cefed649,Photo&File Detect,aplic víru cuid instal adw fic aparec var propagand tod app instal denunci play stor,negative,fear
68c31f47-4a44-48e9-9fba-e1bdd0677890,Photo&File Detect,aind tent,neutral,neutral
6c8472cc-15ba-4c65-ade4-296758c75405,Photo&File Detect,aplic forç instal app lix anúnci tod hor consig mex aparelh cad segund anúnci direcion baix,negative,anger
3401f123-0727-409d-acd1-4331c331fc15,Photo&File Detect,sei pq anúnci começ aparec sei imped instal serv nad vou desinstal,negative,disgust
99a0e786-dfe7-4822-87b8-f97d0d42cb0f,Photo&File Detect,aplic prest nad cai,negative,anger
3645b46b-adc3-4a18-b5e8-c3ae8667354d,Photo&File Detect,app abr horr,negative,anger
df9fd3c6-b29e-47e2-a095-f078b5138926,Photo&File Detect,app lix anúnci segund nad começ vim anúnci celul jog jog offlin app lix recom porqu test test test n deu porr nenhum app n dev aqu playstor,negative,anger
9b8318a3-6df2-432f-beca-66488b716909,Photo&File Detect,anúnci continu vou denunci,negative,anger
87d46938-e61f-41ff-8d3a-72bf91463711,Photo&File Detect,aplic lix tod hor vem anúnci doi doi minut desinstal aplic assim continu ter anúnci,negative,anger
d07d8622-f528-4744-a180-a893a683b936,Photo&File Detect,app lix bem baix fic aparec q mue tel tá víru sequenc aparec app fic aparec min,negative,anger
d72c8a6d-1204-48f6-bdd7-d5d0ac711dfa,Photo&File Detect,pq propagand chat q jog merec estrel n,negative,anger
230d2a9b-b9c8-4122-a9fa-fff8f1d8f0a9,Photo&File Detect,aplic tá trav tel celul quer,negative,disgust
5c523d73-7728-48a1-9651-0cc1ec7eea76,Photo&File Detect,aind limp lix satisfeit porqu propagand temp int,negative,disgust
e910558c-608c-4c95-a558-211add7a3ee7,Photo&File Detect,baix aplic fic abert segund plan ger anúnci so horr,negative,anger
74e899ae-3b45-47d9-8435-8a90dfed6973,Photo&File Detect,nao uze so baix trav tel ped baix nao concigu outr form nao baix,neutral,neutral
a5251d3d-a1d1-411f-970c-cc70c9de95b1,Photo&File Detect,entend nad aind tauv gost aind sei gost tá,neutral,neutral
0a24e5e9-c8b7-4462-9ae1-f2fc7fbfcf02,Photo&File Detect,acab test agrad desinstal,neutral,neutral
38a1f6df-89ae-46c6-8e35-a028a8071fd1,Photo&File Detect,quer anunci,neutral,neutral
291b7f8c-ef7b-4ee4-9947-8e0a4c792b3d,Photo&File Detect,dá entend quê limp contat,neutral,neutral
f55aaccd-32ba-44a0-b867-aa65eb889fdf,Photo&File Detect,negóci aí limp celul tá chei víru,neutral,neutral
69eeb371-04cc-4d8c-bb57-f6843302f94a,Photo&File Detect,app lix horr faz nad deix faz algum cois,negative,anger
7f817485-165b-48e8-8718-3d0b3e00fcfc,Photo&File Detect,abr app ruim cri dev animal cri,negative,anger
d6715038-30d1-44f4-97f1-ce969ebece90,Photo&File Detect,ruim nad ver celul mãe vind ver celul mãe vind ver celul mãe vind ver celul mãe vind ver celul gent dia trabalh celul mãe vind ver mãe tá ond vc bem melhor vind ver jog hoj vai barat vou faz test gravid vc ir merc livr,neutral,neutral
2d05e7a6-db9d-4c8f-a053-6677abf4fffb,Photo&File Detect,bom acab instal,neutral,neutral
6bd74449-5f20-4784-862d-9774c13bf31c,Photo&File Detect,ent quas nad,negative,disgust
1a51d59e-3f0d-442f-b53f-9fc341bfa2ac,Photo&File Detect,horr tô vend víde fic atrapalh filh dpt tmnc,negative,anger
8f99cfa0-9d88-481c-aab3-c03198df7a2f,Photo&File Detect,chat caramb nao ver nad ja ta fic chat tip enquant escrev aparec anunci gat vai pro quint infiernooooooooooooooo,negative,anger
402826d1-7a14-4240-9d4a-6774ca8d8b93,Photo&File Detect,app ruim recom,negative,anger
a9479469-5673-45d0-a259-f7f792542b5f,Photo&File Detect,aplic bom,positive,happiness
2434d42d-4219-45b7-a0d6-363dfe63714f,Photo&File Detect,kkkkkkk mand mens carreg vou consegu pouc son mand mens carreg vou consegu pouc,neutral,neutral
e21d42a7-8ff3-401c-a424-4d2220ff88bd,Photo&File Detect,canal fot favorit,neutral,neutral
48d3f1fb-1956-4efe-8a74-83a4214b1288,Photo&File Detect,obrig experiment aind,neutral,neutral
292bf6e8-73ca-4188-b290-85a1b593ba3e,Photo&File Detect,ese aplic muuuuuuuit propr gand,negative,disgust
34c29613-6355-4359-a97d-e06c8ee9c1d3,Photo&File Detect,tô aguent anúnci vou denunci aí vão ver,negative,anger
ea0ba75e-bb0a-4bfb-a8d7-0a9c64e3a928,Photo&File Detect,bom aplic,positive,happiness
47b297ee-c90e-4582-ae85-b4acfd4cda3b,Photo&File Detect,avis aplic víru anúnci mostr anúnci minut baix,negative,disgust
b4a650ee-7c1f-4f63-805c-ec27a0605707,Photo&File Detect,horr app lix vou us app idiot vou deix app ali u util nenhum,negative,anger
b7662e04-4ad4-486a-92d1-5bd96b389ed4,Photo&File Detect,prim vez q vou utiliz app gost q limp telefon favor,neutral,neutral
0f581ba7-91cf-45a5-b994-18d6428e5355,Photo&File Detect,test hoj aplic vom ver bom,neutral,neutral
7eef5fab-eb35-49cf-a75e-2ef1ebd1077e,Photo&File Detect,nunc use app poss diz bom agor vou us ok,neutral,neutral
05260604-d5ab-4f26-8a5b-8b3ec031e724,Photo&File Detect,ia dar n estrel horr consig entr app,negative,anger
9f649ef1-265f-4ceb-bcdf-8e85e1bfe70a,Photo&File Detect,vim mand anúnci aplic,neutral,neutral
6b729969-963e-4a2a-bc84-649e99f67079,Photo&File Detect,radi deslig,neutral,neutral
035d1d21-60bb-4ee1-9320-f1d0244cc502,Photo&File Detect,continu fal q celul víru n tá okkkk,neutral,neutral
b847239b-a315-4ad5-8fa1-e88d7ca1792a,Photo&File Detect,aplic horr prest lix,negative,anger
c242b0b1-b66b-4e3d-8db2-0ec1640d7e15,Photo&File Detect,so emcomod chei propagand nao rod fic emx pacienss,negative,anger
cd3eb8b4-6b37-40b8-a5e9-3135dc1c478f,Photo&File Detect,lix n deix jog aparec tav escrev avali,negative,anger
31ee6a82-f519-4797-bb1e-449ab7942dfd,Photo&File Detect,sei oqu fal abr aind avaliacaon ped ant começ uso,neutral,neutral
9cff5ec7-d066-412b-9027-c3892c3bdeff,Photo&File Detect,fic aparec anúnci segund,neutral,neutral
8edc6b5a-5b3e-459d-92f8-87b034b7b59a,Photo&File Detect,esper resolv vez problem,neutral,neutral
3fa08e9b-73aa-42c3-867f-8bfc4f18fe5c,Photo&File Detect,sei pq n mim entr ent mim lix,negative,anger
41b1159c-11a2-4d0c-84d5-223ca03c0e49,Photo&File Detect,muit comerc p deix us app,negative,disgust
1e5e0186-0db3-425d-ae9c-ade0772bfa1e,Photo&File Detect,péss irrit,negative,anger
be16ca6a-8d28-4b23-bd35-7c3621c56aa9,Photo&File Detect,va p cas kar aparec cllr app lix,negative,anger
b4a4dbfc-c886-4dc3-88e4-5b69c8765420,Photo&File Detect,val bom rápid,positive,happiness
5c947ab2-0b90-46ff-a3a9-9aebb94aca91,Photo&File Detect,app lix tô odi obrig baix,negative,anger
a0496892-03f9-4ad0-9545-cb0a5cbeaab1,Photo&File Detect,aplic horr tant anúnci,negative,anger
8a0752a8-0495-40af-a74e-00dd7d64ff3a,Photo&File Detect,gost instal porqu fic incomod,negative,disgust
bb39ccd4-4c3b-4186-a433-52a9c7aeb793,Photo&File Detect,tá limp nad,negative,anger
1fc4add4-1d23-4402-8cc2-7dec7e93e7b4,Photo&File Detect,man app ruim krl tô começ fic raiv,negative,anger
8fd99d3f-8d99-4f0c-b5bc-13cf036e726a,Photo&File Detect,poqu sempr twm quw ter complic,neutral,neutral
4163cb9b-ae2d-48df-aa7e-889e57ef4098,Photo&File Detect,report cas continu vir propagand,negative,anger
bb603e02-4cc1-471d-8449-9fb152d24b61,Photo&File Detect,adiant instal,negative,disgust
d06f50bd-b424-42ad-9c79-596505392f1d,Photo&File Detect,bom ajud,positive,happiness
32abbce9-0c79-49cc-aefe-7fafe304b4f0,Photo&File Detect,ruin tod hor mand propagand pest,negative,anger
8bebbb64-20cc-4ecc-83c4-7724e9222ec7,Photo&File Detect,horr dá entr,negative,anger
e38b7776-e8e9-497d-90f2-853a76dbb725,Photo&File Detect,app horr,negative,anger
f77d3e2d-2f33-4b9d-8a42-dcca51f2f49d,Photo&File Detect,gentil larg bagunç,neutral,neutral
ddcf1f13-e561-42a2-a4ab-d11141afa1c0,Photo&File Detect,man suj ganh dinh dev lix,negative,anger
c34993b9-69f0-459d-a3c2-7b7c3d98f656,Photo&File Detect,favor envi,neutral,neutral
7e949a64-11c0-4c12-814c-b5a118904d44,Photo&File Detect,app pod mim ajud,neutral,neutral
a26d827a-0eab-497e-95b7-d9e76ff1c64d,Photo&File Detect,ruím,negative,anger
8d0b9a68-2679-4e60-8bf5-71affd087ec4,Photo&File Detect,aind ced fal algum cois,neutral,neutral
029a1001-7d94-49e2-baf7-1cb83019d3e0,Photo&File Detect,ach app bem útil,positive,happiness
827846ee-e3c3-4307-9223-f38e7f8444d8,Photo&File Detect,serv aqu motorol,negative,disgust
5380f16c-dd9f-4b26-b06f-ffc716cdc5e6,Photo&File Detect,man bagulh chat fic aparec anunci minut to fic raiv ja app lix,negative,anger
c1cd86f3-4690-40a0-ab7e-cd324d8b044f,Photo&File Detect,entr aind fic aparec propag mech app fiq irrit ach víru,negative,anger
51d79cba-bcee-484a-a5c0-508d3e920178,Photo&File Detect,aplic razoá,positive,sadness
68af1790-c957-43fd-a98c-9f5d84b5e040,Photo&File Detect,nao baix app faz anunci surg temp tod nao usa apçic,negative,disgust
ed5dec46-77f7-47ae-8e09-c8ec5f70fdb1,Photo&File Detect,limp arqu desnecessari,neutral,neutral
0d0b7923-91e2-4a98-9deb-791671540109,Photo&File Detect,bom app bast produ,positive,happiness
33ece0e8-5a8c-47ed-8df0-e576987c03a8,Photo&File Detect,anúnci tir séri,negative,anger
0b0e7b61-5856-44e2-b53d-1873caf7ef9d,Photo&File Detect,chat aparec anúnci mim tá instal vou ach algum jeit denunci,negative,anger
7c554154-d492-45c0-bb5a-7369856ad631,Photo&File Detect,,negative,disgust
cc034737-54b0-4d1b-b090-98583dfea6a1,Photo&File Detect,ta ench ssc anúnci contat zap sac,negative,anger
f267dedc-b90b-4c4b-a1e9-b9642b0a49bb,Photo&File Detect,aparec anúnci celul,negative,disgust
7d3a1e8e-1592-4b61-8ea3-6980c83f5181,Photo&File Detect,favor ped limp celul horr,negative,disgust
6473505e-ecd2-466d-8b85-bfacceef29bc,Photo&File Detect,experi sempr boa obrig,positive,happiness
b2ac35a5-652d-48e0-8d4f-8cbb50d88f38,Photo&File Detect,horr muit propagand,negative,anger
ec3ab800-243f-4cde-acc4-83c8898ca9ad,Photo&File Detect,quer ver anúnci,neutral,neutral
