reviewId,app_name,content,sentiment_polarity,sentiment
f3e9d5f3-e272-4f3b-b671-f44401e75345,Tiktok Lite,vai ter opç deix mud muit cois legal ouv músic us tik tok ótim,positive,sadness
d629f28f-aee0-4f2f-8ca4-5672b96b826e,Tiktok Lite,odi brilh fic aument automatic retir funcional,negative,anger
273ad565-7d03-4986-a141-36b172f659d9,Tiktok Lite,app bom faz log atual pod ver fot tent ver fot consig ach ruim consegu ver ent faz atual consegu ver fot,positive,sadness
56cf07c3-83aa-45c6-a6aa-04fc2af62a90,Tiktok Lite,péss aba melhor simples sum ninguém respond feedback vez fic tao lent q n entr,negative,anger
2bebedc9-f5b3-4e2e-8ffd-f8eeb1addb38,Tiktok Lite,app bom pod ter funç repúblic ver fot pq vez chat vc entr víde fot aí dá ver vc qu repúblic víde dá,positive,sadness
2bbaf01b-4295-4976-97d0-f3309f78e342,Tiktok Lite,bom tod via precis melhor qual gráf pod melhor efeit etc ach bom app melhor bj leu aq opin ok,positive,sadness
8b885444-5a64-4f75-97f2-6f4ef68910f2,Tiktok Lite,excel aplic conhec divers recom dúv val pen cri perfil tok tok parabém cri faz temp pass depress,positive,happiness
2efd7c67-d658-4752-a407-216d938364bf,Tiktok Lite,bom aplic gost poi distr bast cheg trabalh tant problem real relax val pessoal,positive,happiness
badcbcf6-5f63-4077-8544-3099c221b758,Tiktok Lite,app bom legal veloc tir bom legal lev nok tijol cust mb mb lev bem tiktok norm cheg pé lit tiktok norm cust mb muit memór nok tijol tá memór app val apen baix,positive,happiness
44b2a501-753d-493c-b256-6bd1083a5ff5,Tiktok Lite,n goxt asm incr ame nov text azul play story volt tik tok bom ador víde poss curt coment post víde,positive,happiness
2cdd33b8-fee4-4efb-8993-e3f577851f7a,Tiktok Lite,app excel trav func vers antig android android tud porém tiktok lit desatu difer suces tiktok norm muit funç aument veloc ver vide imag enquant tiktok lit nao enta favor quer concorr públic econôm precis mant tiktok lit atual acord norm tir tud bom,positive,sadness
370287f2-a5a0-4f2a-902a-98fa2bae1c0d,Tiktok Lite,gost vers lit tik tok pó rod norm celul contr vers orig mes uso consig ver post fot acess víde um mes promet ter funç ver post fot agor nad,positive,sadness
24ad521f-4074-4932-9435-41c5bf84da40,Tiktok Lite,mud radic opin tik tok lit exempl aplic lit dev mantém vár funcional padr remov real pod pes lembr vers assist víde pens faz pen aind possu mod escur ach padr dev ter aind android funcional básic qualqu app lev ano adicion complic viu,positive,sadness
8dc9e1ea-4f23-43af-acd0-9482ebc5e331,Tiktok Lite,aplic alt otimiz proporcion experi excepc naveg suav temp carreg rápid consum recurs mín efici not garant desempenh excepc long dur bat escolh ideal busc app rápid efici alt desempenh,positive,happiness
2ccd705f-1d76-4ce3-bd67-e60614cd79c6,Tiktok Lite,ach q dei not caus efeit q séri aind precis melhor form trat cont pequen cri víde cai muit vez final víde dem d fic parec q quer q faç dezen problem vizual q ach n critéri post víde vár plataform aqu visual víde baix dia neim jr visualiz vide q ger quas visual migalh,positive,sadness
080b5044-bb0b-4c6d-9b7d-a57bcbaf6b21,Tiktok Lite,app boa fácil us algum anomal not exempl tiktok lit consig faz login outr cont youtub instagr etc pouc númer efeit aqu sequ opç tel verd aparec opç coloc tiktok mod clar escur eph muit cois not descrev vou termin agor gost app opç text fal,positive,sadness
c34f5538-18c4-4017-9a13-cf09b85e72ac,Tiktok Lite,bom parabém desenvolv entreg oqu promet tr nad tel lis parec tiktok trav us porém nad perfeit hoj dar estrel poi grav víde utiliz app poi tiktok norm tr falt milh efeit favor adicion falt muit cois sup útil gr víde ótim,positive,sadness
cd7de589-5486-4ab9-9540-d3e218d0f4f2,Tiktok Lite,bom bem lev bem otimiz únic problem algum recurs outr vers vers lit clar menos recurs atrapalh experi ver víde coloq estrel,positive,sadness
9df3c9c2-2482-44f3-b925-1f767c0a39d1,Tiktok Lite,app ótim séri pod disponibil funç ver víde fot arrast favor,positive,sadness
971f3318-081b-462a-87ec-f48bde69b837,Tiktok Lite,gost plataform ban man vou outr cont vem avis ban permanent cont nov consig resolv bem opç ajud,negative,disgust
bfc23336-c792-4829-a1b3-4f42654dff82,Tiktok Lite,app si ótim melhor tradic porém cad opç post víde fot tá hor atual viu assim venh aqu estrel,positive,sadness
761981ab-f64f-4fbb-86be-0a6e51c9894e,Tiktok Lite,app princip trav desinstal vim titok lit melhor precis ícon legend,positive,sadness
3cd27ac3-0111-4876-a07a-4fe49d81a991,Tiktok Lite,tint du ach bom porqu ensin muit cois boa outr deix desej porqu muit cois ensin metad poriç vou dar estrel,positive,sadness
0f0c8609-d084-46b3-b051-62b3622826e9,Tiktok Lite,ent reclam vers aplic funç x funç y cois tal etc sent lit just ter cois faz aplic pes memór princip qu um víde aleatóri pouc deix lá cumpr funç perfeit,positive,happiness
f59ef841-0ea4-49a7-8cf5-8eb0ec9b8529,Tiktok Lite,ador ir ness loj menin sempr atend bem ajud ach alg sempr atenci educ produt bem encontr,positive,happiness
20de173f-52ac-4757-b923-39746e9f13ac,Tiktok Lite,bom app si ótim afinal cad post fot quas ano atual ñ vem ent esper arrum log cheg ter tiktok norm perceb melhor esper arrum log porfav,positive,sadness
c48620b7-973b-496a-8b48-39bff4691fd2,Tiktok Lite,olh chate aplic tik tok confund mens exclu tod mens dess viol diretriz nunc aid mand diz engan ped desculp constrang gost bast diret fal porqu alert particip golp diss porqu aplic tik tok gent us fot americ faz golp mulh sim testemunh grat sempr,negative,disgust
cc18a9f2-a2d6-4e68-880b-6613369f4c60,Tiktok Lite,gost dest app nse post fot consig escolh músic ouv escolh pod ajud resolv obrig antecipad,positive,sadness
59bf9e0b-9b60-422f-b04a-659812337dd8,Tiktok Lite,app si mt bom cois mt ruim n pod ter acess muit efeit bot muit som voz app ótim,positive,sadness
f37b75bc-28ce-4127-974b-a4292501b717,Tiktok Lite,bom vez apresent algum defeit desd atualiz dá zoom aguent baix efeit,positive,sadness
b96d00db-1d53-48d6-bca0-8cc0a11b311a,Tiktok Lite,app mt bom recom mt além diss gast pouq memór pro básic caus efeit tod tir app mt bom sup recom,positive,sadness
0be50ffe-4254-46f4-ba5d-2416884d94ba,Tiktok Lite,simples perfeit comec us cont tik tok bug perceb bom lit menos pes bom us celul pouc memór antig bom experi sid perfeit parabém favor baix,positive,happiness
72fa196f-68e4-4be3-9e92-c4161da7013d,Tiktok Lite,bom vici muit pesso perd control açõ caus víci aplic caus caus procrastin enta cas vc herd taref trabalh faz nao recom,positive,sadness
3ef0a091-9c4f-42ba-95c3-3ac46f6492a7,Tiktok Lite,app ótim diretriz dur ban cont caus vide carr alt veloc send vej cois tem sexual,positive,sadness
bb2494a3-7100-46b7-828f-59d9f10ecf40,Tiktok Lite,mt bom ótim mt espaç cell funç ver fot fal funç vai lanç brev agr nad estrel funç,positive,sadness
d87c246b-191f-474c-a5ac-ea8006aea030,Tiktok Lite,gost porqu mesm cois tik tok norm tir bom efeit ter nao liv nao veloc vi vide odei entr escrit cois not,negative,anger
ea950824-a107-4c21-b243-a2231db82c75,Tiktok Lite,bom tik tok algum cois pessoal ach quê post ano recom pesso mai ano,positive,sadness
8f7b5050-c1cf-4e97-a7cb-b8dea20d8a42,Tiktok Lite,bom conhec pesso comunic ganh dinh lá cert tip talent mim funcion,positive,sadness
f977bb05-70d5-428e-91e0-d0ee6329c8ce,Tiktok Lite,olá app top uso porém consig faz download víde compartilh envi assim hoj link,positive,sadness
382de96f-a76b-41dc-8f98-ad4a4f47eef0,Tiktok Lite,falt algum opç vers orig quest app melhor vers norm tr,positive,sadness
6b9bda10-c70c-4a52-9783-f9f30c53f736,Tiktok Lite,porqu app aparec liv vai barr pesquis aparec nad víde perfil tiktok faç favor corrig,negative,disgust
231dd0f4-cbd4-41fa-9fbf-94ced353a471,Tiktok Lite,bom cumpr promet pod atual acord app orig fic melhor aind obrig oferec app excel,positive,sadness
35949c3c-2ab8-44b1-ba5d-6726dd400a91,Tiktok Lite,ador amo dm gost part víde flop ok né bem oq quer pergunt vc vão coloc opç ver fot cri outr cont ver liv bem pod ter ocup menos dad ide gost dess ide respond pfvr fic feliz dm,positive,sadness
54121039-d9c4-4386-bca5-8b0708587433,Tiktok Lite,aplic bom tend algum bug entreg conteúd cert entreg cois inter integr cois total aleatór,positive,sadness
b1254fb1-972f-41a3-9eef-2ffdc5fb7412,Tiktok Lite,vez aparec agent seg tá segu tequ renic celul ruim agor tá bloblem qu post nad,negative,anger
e34134cf-7d2c-4189-806e-3b32fe31479c,Tiktok Lite,bom apric ajud pouc pesso espalh víde gent ver ruim dev deix víde livr tod mund ver ganh segu curt kaw ajud pessoal,positive,sadness
7b9743ca-1b6e-47e2-85fb-9373a7273dee,Tiktok Lite,app bom reclam app ótim passatemp distra dou estrel ótim,positive,happiness
1cdfbf87-63fd-4e96-926f-f2c6661e5551,Tiktok Lite,nao gost atualiza vide nao vao ant envi zap ant pesso via vide ter q entr tik tok agor q ter tik tok ver vide post vide tik tok statu agor par cont diss pesso ve statu q entr tik tok ver q post sens poi mim tao ruim post cois edif vid melhor palavr boa cri alg q vai fas sent bem muit pesso q so ver,negative,disgust
806858a4-f36d-4ece-a3f2-6569ab9d6ebf,Tiktok Lite,bom ach bom caus dá faz vári víde dá faz vár cois aplic músic ach bom porqu lá vári fam fam,positive,happiness
1b3202e6-f7d9-45d6-8b3e-3673c6c63852,Tiktok Lite,bom ach pod adicion funç mod escur app funç víde fot,positive,sadness
5a1f874c-1d8f-4d37-beea-44c1885e25db,Tiktok Lite,diz plataform utiliz mund int gost pk pes nenhum boc sup sofistic aplic ter opç dá respond mens víde dá coloc mod escur sincron tik tok lit cupcut aplic ter vár alter tik tok ter opç além diss efeit estrem podr tent baix,positive,sadness
7b69b038-0728-44be-ac36-086820119622,Tiktok Lite,perfeit agor fal tiktok am sempr faç víde lá precis ir capcut fal tiktok agor fal víde nenhum ediç tá ótim parabém tr perfeit únic ediç fal,positive,happiness
742c0314-1e22-4784-b4ce-1ac8d66cfac4,Tiktok Lite,bom dia tik tok app muit advers apresent sempr moment contagi muit energ boa,positive,happiness
8ccd3997-0710-4186-9eda-6c0789d78adb,Tiktok Lite,exceç algum víde tik tok ajud muit pesso através muit víde bom mim prest coloc bols fur,positive,sadness
4097350b-32af-4980-a625-4a82504bc454,Tiktok Lite,aind continu consegu atual fot perfil atualiz googl fot aplic aind continu anteri resolv aí,negative,disgust
7ec26a80-e2f4-4221-9e57-18a6154e8794,Tiktok Lite,gost app quer coment q app tom espaç memór quas gb espaç tod vez atualiz fic cad vez mai pouc espaç aparelh,positive,sadness
f9268486-15bf-49e7-b309-e1b311f1256e,Tiktok Lite,bom sup econôm rápid fal tr top,positive,happiness
4e1c0ca8-e746-4862-bde9-d31eadd119aa,Tiktok Lite,pod ter opç bande adicion favorit igual tik tok norm respond pesso marc mesm set deix tel int nov aí fic bom,positive,sadness
965a9ba2-2fa7-4c7f-8cb5-738f85c8981d,Tiktok Lite,tiktok norm sempr trav cerul tiktok lif bom rap pequen prát pacot per feit gent cerul frac recom,positive,happiness
c5573426-b00d-453d-99b7-79d4fdb2880d,Tiktok Lite,tiktok bom filtr efeit abr faz víde sei celul tent faz víde danç abr,positive,sadness
1a3b94b5-66bd-4f33-85dc-f7e652def89e,Tiktok Lite,app bom poi difícil q faç conteúd tik tok permit imag ocasion instal outr app ediç vc qu grav pro tik tok aí sim bom instal aproveit seg luf,positive,sadness
24cb409a-82a8-4706-8d16-e9e735483c70,Tiktok Lite,amo tik tok lit app incr not dou estrel aproveit post ness aplic vez exempl vid mim obrig tod faz i uso desc aplic parabém,positive,happiness
72940a44-5e61-476d-9860-a095fa09ccfd,Tiktok Lite,prime boa noit sei cont mi ped víde dá respond coment víde sei desatu quê consig msm nov atualiz problem mantém,negative,disgust
7d8c6186-3944-460f-ba69-c2a216ba8a1a,Tiktok Lite,inform melhor antecip jorn livr exp ide grand admir chin tud faz intelig disciplin,positive,happiness
65631714-2059-4d29-882b-952341739079,Tiktok Lite,lit func melhor cad liv dai us outr bug demal probl melhor,positive,sadness
1a875967-0dc0-4855-99fa-f5fefd5bd72e,Tiktok Lite,uso tiktok quas ano diss aparec cont suspens idad send comec us quas ano ano agor esper vej consig cont volt pod consig gost víde cois aparec lit aparec norm esper resolv log,negative,disgust
49bd694e-e644-49ab-b08e-a563d4025ad1,Tiktok Lite,app ñ muit filtr menos quer respond coment víde aparec muit configur ach dev ter mesm qual tik tok kit,positive,sadness
3fe34db3-6e96-45f2-b57a-8d4f7d3f88be,Tiktok Lite,app si bom tud perfeit ent começ cond instal consigu cri cont tir app ótim sup recom beij,positive,happiness
51019480-0fcc-4426-945a-a855727dcbb3,Tiktok Lite,app si bom funç fot cad tbm tod efeit tiktok norm ent fal tchau,positive,sadness
f96faa51-05c3-4582-8623-f4df289fb716,Tiktok Lite,app simpl perfeit únic cois q encomod fat pod public víde minut pod post fot app mt bom,positive,sadness
65c81642-b64f-4659-91f7-6d15aebbd031,Tiktok Lite,complic pod respond vide sair chat priv fot pod ver melhor ne favor,negative,disgust
7ccc5af5-6b8a-4d8b-86cd-14bb0b64272c,Tiktok Lite,ótim mund app nao estud vc car honest profisison traz formul ajud particip tud nessecit obrig,positive,happiness
96c25893-9444-4fbf-a2e8-4acb58dce7ff,Tiktok Lite,app bom uma cois pod coloc tip mand ft mand mensang pod dua pesso segu i tiktok lit mud dou estrel pess uma pesso ajud,positive,sadness
917fd81f-fb20-4ae1-b28f-5f993cd868ec,Tiktok Lite,bom vez assist vidi tr dem normalis vidi pod ter temp reproduç tip músic,positive,sadness
09ce3fde-5fad-4b30-8c9c-044ce5b87648,Tiktok Lite,vou dar estrel pq app ótim precis melhor traz nov atual tip rebublic víde fot tiktok norm,positive,sadness
bbff3222-a88e-49ec-a5be-f9767932f047,Tiktok Lite,tik tom lit bast econôm simpl esperienc únic naveg nest app recom us mesm tik tok lit,positive,happiness
2494dcea-c786-4b22-84a2-47c2c544110c,Tiktok Lite,vers cois boa rápid carreg víde rest nad bom vc conseg us filtr,positive,sadness
3082774d-badc-4adb-afba-9047cb1560fd,Tiktok Lite,tik tok prim tod conhec ajud cresc benç atrás benç deu abenço grand vers tik tok boa light melhor app ajud trabalh maravilh senh jesu crist amém,positive,happiness
2f3ca8e6-1dfc-4df8-b56d-2af02c1b881b,Tiktok Lite,app bem bom n nad defer ing tikitok real dou estrel bom tiktok verd n consig anaix celul n aceit má graç deu aparec tiktok parab cri vc bom quer faz cont n sei faz cont bem bom má pod vc n faz ve cont var pessou vom problem msm assim vou estrel bem basic bom demal esper fas jogu vou ver jogu vc bem bom tchau obj,positive,sadness
58f3458f-1898-4c7a-9a76-c1726f5ab5d7,Tiktok Lite,real aplic bom tá atualiz consig faz quas nad celul atualiz muit vez fic igual mãe consig ver legend quer melhor amo aplic,positive,sadness
df7049b8-7551-4e3e-98c5-a02c94ecd1c1,Tiktok Lite,bom muit cois si pod mud tip post fot dá abr opça peg efeit víde vc viu algum efeit bom aplic ótim pod mud fic melhor aind,positive,sadness
60f47245-fc15-4465-8a79-3d1359e4ff50,Tiktok Lite,lev q tiktok melhor cois usa bast tiktok quer republic nel porqu fic vazi republic,positive,sadness
c5dbfbaa-b75b-48ed-9c27-34fe05244cd6,Tiktok Lite,ach bom app bem lev tr pod ter republic app orig ia perfeit,positive,sadness
51972efd-0fde-431a-8a06-1ec6c049222e,Tiktok Lite,aplic sensac bom divert ver conteúd dá grav conteúd pod ver pod ver artist favorit pod artist outr pesso gost tik tok bom recom,positive,happiness
bfe10ff5-8cb8-49c3-b239-1dc0a6b162f2,Tiktok Lite,dou trê estrel porqu experi app encontr algum bug gost app bom lev,positive,sadness
f9fd48f6-bf69-4383-88a3-c88cd3f1a355,Tiktok Lite,soment quatr estrel poi falt legend portugu coloqu poi ajud bast traduz,positive,sadness
4e4bf8f8-0299-406f-b4e5-e8fb0059579f,Tiktok Lite,bom cois q nel bomb algum efeit outr bom além n ocup espaç,positive,sadness
21139ff0-69c5-49d5-88f4-3d81c5f72efe,Tiktok Lite,bom aplic vc divert faz víde interag outr princip pod ajud complement s rend dá lov,positive,happiness
17139f39-618a-472d-a057-d06876f6a72f,Tiktok Lite,app bom ópt lev fácil us aind estó fas explor ra dei estrel termin avali sab estrel cresc,positive,happiness
6b5c87a8-c9a6-4c0e-9631-c5ec4a23b8cd,Tiktok Lite,app pod melhor cont celul bom abaix tiktok norm ach pod coloc cois tiktok lit,positive,sadness
c137e046-51ce-44e8-bafb-504725e45223,Tiktok Lite,troq norm lit vou us lit outr ocup espaç pes cond,positive,sadness
48a27c79-caff-4462-b80d-a573e992f43a,Tiktok Lite,ide lit func bem bom gost us efeit víde post quer mod escur,positive,sadness
e96a57e1-1a67-44e8-b75f-93dbb38e8bb3,Tiktok Lite,ótim vers ttk igual menos gig ach pod ter algum cois outr,positive,sadness
785abcbe-bc39-4d19-b6af-6e7396d8e19f,Tiktok Lite,app mto bom fic fal áudi exempl vc n cóp áudi vc morr vc n us áudi vc ganh not ruim oq n gost tir app mto bom exclu víde iri am,positive,sadness
76304274-4119-4523-9cec-8371843d4de6,Tiktok Lite,decepc víde mulh oferec mercad opç igual kw vc clic coraçã part aparec gost env víde assim sint confort kw,negative,disgust
bc437096-1873-4063-81de-116e774bd1b9,Tiktok Lite,si aplic bom amig mand víde vár imag ver tik tok lit aind recurs favor vam resolv,positive,sadness
1936f3fa-6e01-49d4-a6a6-d96fa4d527a9,Tiktok Lite,convers tiktok lit rápid ment cliq nel fic carreg infinit acredit perd temp aplic,negative,anger
ad44e487-716c-451b-bc34-68d34ebfac8f,Tiktok Lite,visual víde péss falt distribu víde gent públic víde agent sempr esper ó melhor acontec tiktok,negative,disgust
ab51658b-9078-4d17-b3c4-18327c9bf77c,Tiktok Lite,bom porém tod vez consig atual vers tr tod tent send ocorr,positive,sadness
c1d3cec9-8479-4191-8835-752b0178263a,Tiktok Lite,app si bom pod pouc igual ttk norm ter efeit mens visual fot,positive,sadness
7100f8a3-cf26-4c01-bc77-6c67399070ce,Tiktok Lite,coloqu opç deix víde mud sempr quer víde sobreponh músic ouv fon pens pesso ouv jog rádi quer continu mex telefon,positive,sadness
f100428a-bdcf-4eb4-ac37-797be393f3ff,Tiktok Lite,dei estrel porqu gost dess app bom falt pouc consegu estrel pq quer cheg plataform víde vc arrast lad fot,positive,sadness
a5c93702-4909-486f-95fd-7bee74cbea8f,Tiktok Lite,ótim aplic dev us exempl outr empr simpl fat tir funç princip app princip tiktok tant pequen problem fat ter public fot moment dess review princip cois sint falt aplic relativ ótim,positive,sadness
9d29983c-07f5-4864-8966-fbf6138d16da,Tiktok Lite,olá app bom fic pouc graç funç republic post fot ent vez perd graç poi muit gent post funç ver víde,positive,sadness
65475788-fd4a-420f-a45f-aac0fdbe77f4,Tiktok Lite,am tik tok lit víde mens tod gêner gost envi mens músic lind pais,positive,happiness
1bd3d701-5fe7-4d33-8ac4-28fe25c66035,Tiktok Lite,bom ach app ótim excel porém dev ter opç convers pesso ach fic melhor aind tir app ótim esper coloq opç convers pesso,positive,sadness
3ffe4fdf-b0c9-4a63-a964-b83a1629e83a,Tiktok Lite,dand trê estrel app recent bug lig app vez dem abr fech app vide ja assist volt outr vez,negative,disgust
0f97fec5-36e9-4ffb-864f-752d4b531a36,Tiktok Lite,bom dificuldad poi cadastr pesso link aparec recompens cont ganh moed assist víde,positive,sadness
a7f3e6dd-376b-4d87-aed9-6990bdd56e7a,Tiktok Lite,olá boa noit bom ame app sempr uso problem pod ver fot bem bom confi us,positive,sadness
c761598c-dd63-441e-bb42-8840d40b19ed,Tiktok Lite,app bom tr q norm porém aind ver fot reclam precis dess atual,positive,sadness
f59034da-2da1-4eb7-80ab-5ca784d4f029,Tiktok Lite,profes educ físic gost algum ativ físic idos,positive,sadness
d370ab9b-f7cd-45b8-bb29-610be1ad0540,Tiktok Lite,bom use moder temp bat carreg internet boa viag janel virtual abert ver mund hom offic,positive,happiness
f94bcc67-71cf-42ae-be11-3a9f5fc68ddb,Tiktok Lite,bom moment tik tok mostr democrá mim contr met bandi apen lad grup globolix,positive,happiness
3a183eec-32aa-43aa-83aa-00ed160b2754,Tiktok Lite,melhor aplic econôm rápid pro smartphon consig limp cach dentr app gost,positive,happiness
57335936-0ba4-4111-9165-04383fe3f6b6,Tiktok Lite,app maravilh bom além econom espaç tbm algum opç filtr bom gost,positive,happiness
42172570-667f-447e-9b0f-6c5879ffb744,Tiktok Lite,aplic bom celul lev celul espaç porém adicion fot igual tik tok orig tir ach bom,positive,sadness
bc797fbe-95ed-4c00-826b-5db3175e33a2,Tiktok Lite,pod traz cois tiktok norm lit exempl fot traduç automá outr cois,positive,sadness
45852d25-ed76-4220-a018-b2c108803427,Tiktok Lite,baix tiktok norm abr celul vou baix lik ver sai espect dev menos possibil ver anális conteúd disponibil ferrament cri,neutral,neutral
5a264cb6-84c0-4fbf-9d0e-40213aa2b5bb,Tiktok Lite,app tikitok bom tod gost sempr acest ador kere fa part dess app sempr s la ccois emgrac ador tikitok nao pod par dua cois ki sempr gost tikitok cinc estrel aval tikitok not emteleg kapacet sab ajud pesso as sempr mim oremt agradec ke preses keri melhor mae preses ajud amig agradec tud bom recebemd bem ajud boa pesso,positive,happiness
b1315c9c-d60e-4ab3-b109-732788ea3c92,Tiktok Lite,aplic ótim melhor liber víde fot áudi aí sim dar estrel,positive,sadness
4942d6c1-41c9-440e-a180-308079b0014e,Tiktok Lite,tiktok bom tr pouc bom legal efeit legal ame efeit simpl fof,positive,happiness
a228ce71-b0e4-4433-afdb-e53b154e3e3a,Tiktok Lite,tir ícon salv víde faz play list app fic horr,negative,anger
404767d3-384a-4db2-af4d-3c0f12c55ff3,Tiktok Lite,bom ent crít nenhum porém vim dar avali sim real bem fácil us lit qual si rápid fácil,positive,happiness
589a603c-4f7e-4079-ba3d-6738fcbb474e,Tiktok Lite,atual aqu nov reclam app si bom tud perfeit traduç coment,positive,sadness
39d84029-daf5-4ada-ad4c-0780f93fe0d4,Tiktok Lite,bom us consig ver tod notific consig tir fot bom usa lo n rol automá,positive,happiness
d866e270-359f-474e-8de1-16a08482ff37,Tiktok Lite,otim palavr esplic quest atual agent conseg escrev tir app otim sup recom,positive,sadness
810bce7f-5553-4854-9481-da8064f27de0,Tiktok Lite,baix tik tok norm app bom tr falh celul problem quant internet aplic consom ent gost vers lit boa consom muit internet,positive,happiness
4b7c4f82-84c8-479f-9bf5-462b416dde2e,Tiktok Lite,aplic bom sempr vou procur algum cois barr pesquis nunc ach nad fory víde,positive,sadness
4144e67d-0cb8-4bd1-8abb-fb55fcfc27e8,Tiktok Lite,real bom pq tr menos agr tr sai app so du nad q cheg opç republic ver fot lá traduz text,positive,sadness
918b373e-5e9a-4b32-95b3-55c5add17771,Tiktok Lite,ótim app ach dev ter opç ver public poi sempr fal pod ver brev nunc mostr,positive,sadness
34dd615c-8c68-44d8-9691-d6b39049ecd9,Tiktok Lite,cois legal institu pod faz ajud animal abandon tud faz taref ajud kw projet issoqu fiz coment vam faz part bb s kw app w qhjg efz,neutral,neutral
67d0b0ae-3bd0-4492-9f3b-733b486fa55f,Tiktok Lite,bom toqu vej sempr pequen defeit tent baix cont qu ir ent favor vej,positive,sadness
ac8a790c-8459-4668-b5e1-3367f890fbec,Tiktok Lite,vers lit boa aind celul antig pouc memór carreg víde rapid parabém,positive,happiness
a94a8447-5bae-419d-b92e-dd094624d34e,Tiktok Lite,legal variedad cond filtr acord inter pessoal fant,positive,happiness
4b4c3c39-4afa-4336-88c3-9a87c64ff66e,Tiktok Lite,app bom pod melhor víde pod dar ver vou visual víde mand fal víde vai dispon futur fic bem chat esper quer filtr aparec gost ver melhor filtr ond poss escolh cois hashtag quer apareç vem muit víde simples odei quer ver man algum incomod grand variedad cois falt,negative,anger
58338bed-5793-4c3f-a5eb-029dd9bad911,Tiktok Lite,aplic excel gost mim deix satisfeit opç oferec ótim,positive,happiness
2fc04a63-405f-4c4b-aa35-ca9b46bc36a4,Tiktok Lite,unic ruim q n igual tiktok norm bem q pod coloc funsa q dess baix vide marc log tiktok tod tip celul,positive,sadness
2b9bed03-c2d1-47f0-94eb-6e9a8046fe29,Tiktok Lite,tô aqu opin utiliz doi tiktok infeliz alcanc limit cont orig abaix bom chat mim cri outr cont quer cri outr chat outr cois post fot igual orig deix chat outr cois vc pd err dat nasc cri cont chat estrel ia dar n origian estrel,negative,disgust
08d559c0-acd7-4ac7-a3bf-575f740aa958,Tiktok Lite,ach aplic ótim aplic precis melhor efeit filtr públic geral us tod mund celul bom us celul modern fic prejuíz demal pesso motiv aplic deix legal ótim públic geral,positive,sadness
c19a90a8-05de-47ae-a468-c1d1ec682134,Tiktok Lite,wow tik tok fácil us muit opç faz víde obrig gost dest tik tok,positive,happiness
c6e04a25-3cb7-4889-834c-d71148e953c3,Tiktok Lite,cad dia efici confi melhor ferrament cri surpreend sup indic,positive,happiness
b244360c-6f05-4e9a-82b4-30a4b9965633,Tiktok Lite,gost dess tiktok lit rápid tr melhor outr tiktok lent tr bast dou cinc estrel parabém cri,positive,happiness
cdc823e9-26c0-43b6-8189-6d00cb532ae3,Tiktok Lite,ótim app ressalv relaç ediç temporiz tud cert,positive,sadness
76bc7217-b746-4efb-8fed-64841f46f341,Tiktok Lite,olá tik tok olh mnh cont suspens mes nn consig volt mnh antig cont cri outr prfv ajud problem mnh cont nn nd msm assim suspens tent númer telefon vári email resolv prfv,negative,disgust
d4f4e7d3-1ecc-4fe0-8e92-70184803d41b,Tiktok Lite,aplic excel apes ter pouc funcional orig us ocup menos armazen,positive,sadness
d09c75cc-6cec-48be-a017-32741aeedd41,Tiktok Lite,si bom pud assist internet melhor internet crédit ótim esper próx vers poss melhor err tchau,positive,sadness
48ee64ea-d145-4de5-a93d-46a7b278c79a,Tiktok Lite,bom rod bem melhor tik tok norm pod coloc recurs tik tok lit ia fic daor,positive,sadness
cc0c77b3-0a5f-4a8f-a630-cf94c111411d,Tiktok Lite,parec bom horr tiktok melhor tiktok lit mord deu gnt nn recom app ruim,negative,anger
aa7fad19-a021-43f1-aa60-028b7c71cef6,Tiktok Lite,legal nunc vi aplic quã legal quant deu céu sempr quil test tiktok orig tiktok lit legal complet vou avali cinc estrel maravilh aplic,positive,happiness
